{
  "technique": "standing collar drag",
  "starting_position": "standing grip fight",
  "stance": "standing",
  "primary_actor": "blue_gi_player",
  "secondary_actor": "black_gi_player",
  "primary_actor_role": "demonstrator",
  "secondary_actor_role": "partner",
  "visual_identity": {
    "primary_actor_gi": "blue",
    "secondary_actor_gi": "black",
    "skin_color": "beige"
  },
  "intent": "takedown",
  "viewpoint": "third_person_side_view",
  "camera_focus": [
    "blue gi collar grip",
    "sleeve control",
    "offline step",
    "partner forward posture"
  ],
  "body_constraints": {
    "blue_gi_player": {
      "stance": "standing with one foot stepped outside the partner's lead foot",
      "grips": "one hand grips the black gi collar while the other controls the sleeve",
      "pull": "draws the partner forward and diagonally past the shoulder line"
    },
    "black_gi_player": {
      "posture": "standing but tilted forward from the collar drag",
      "feet": "lead foot light and beginning to step to recover balance",
      "arms": "collar and sleeve are visibly controlled"
    },
    "labels": [
      "Blue gi demonstrator",
      "Black gi partner",
      "Collar grip",
      "Drag direction"
    ]
  }
}
